Washington,MN,"Senator, Arrested at Airport, Pleads Guilty",https://www.nytimes.com/2007/08/28/washington/28craig.html,28-Aug-07,,,,,,,
Washington,MN,COLLATERAL DAMAGE:,https://www.migrationpolicy.org/pubs/NFOP_Feb09.pdf,2009,,,,,,,
Washington,MN,ICED OUT | How Immigration Enforcement Has Interfered ...,https://www.nelp.org/wp-content/uploads/2015/03/ICED_OUT.pdf,27-Oct-09,,,,,,,
Washington,MN,More than 150 arrested in bust of synthetic drug ring,https://www.cbsnews.com/news/more-than-150-arrested-in-synthetic-drug-ring-bust/,15-Oct-15,"1. no, the text does not explicitly mention washington, mn or mn (minnesota). the article lists several u.s. locations but does not specifically include minnesota or washington, mn in the text.

2. yes, the text is related to immigration agencies' involvement in arrests, but these arrests were for a synthetic drug ring bust, not specifically for immigration raids. the involvement of immigration and customs enforcement (ice) suggests a role in the operation, but it was in the context of drug enforcement, not immigration law enforcement exclusively.

3. yes, the text mentions the date as october 15, 2015, and it is not around the date of 1/7/2016. the date explicitly stated is several months before january 7, 2016.

4. yes, the text confirms that immigration and customs enforcement (ice) was involved in the raid as part of a joint probe. the investigation involved multiple agencies, including dea, ice, customs and border protection, homeland security along with local and state agencies. thus, it is clear that ice played a role in the synthetic drug ring bust.",,,,,,
Washington,MN,IWW Arrests and persecution 1906-1920,https://depts.washington.edu/iww/persecution.shtml,11-Jun-15,"1. yes, the text mentions washington multiple times (e.g., tacoma washington, seattle washington) but does not mention mn or minnesota explicitly.

2. no, the text is not primarily related to immigration raids/arrests. while it deals with arrests and raids, these are primarily about labor activities and actions related to the iww (industrial workers of the world), rather than immigration-focused enforcement.

3. no, the text does not mention the specific date of 8/22/2016. the timeframe described in the text is between 1906 and around 1919, focusing on historical events and incidents relating to the iww.

4. no, the text does not confirm that any raids were conducted by immigration and customs enforcement (ice). the text details various raids, arrests, and legal actions against iww members, but these are described in the context of police actions or other organizational interventions, not explicitly by ice.",,,,,,
Anoka,MN,#209: 03-31-04 MORE THAN 130 ARRESTED IN ...,https://www.justice.gov/archive/opa/pr/2004/March/04_crm_209.htm,31-Mar-04,,,,,,,
Anoka,MN,25 arrested in Twin Cities in international sex slave bust,https://www.twincities.com/2007/05/21/25-arrested-in-twin-cities-in-international-sex-slave-bust/,21-May-07,,,,,,,
Anoka,MN,Drug raids put eight behind bars | Crime,https://www.presspubs.com/isanti/crime/drug-raids-put-eight-behind-bars/article_df331494-ffd5-11e0-b3a1-001cc4c002e0.html,26-Oct-11,,,,,,,
Anoka,MN,Immigrant Rights,https://www.aclu-mn.org/en/issues/immigrant-rights,13-Feb-12,,,,,,,
Anoka,MN,BCA Home - Search Criminal History,https://dps.mn.gov/divisions/bca/Pages/criminal-history-search.aspx,1-Jun-11,,,,,,,
Anoka,MN,29 charged in bust of sex slave ring tied to 3 Minneapolis ...,https://www.twincities.com/2010/11/08/29-charged-in-bust-of-sex-slave-ring-tied-to-3-minneapolis-gangs/,8-Nov-10,,,,,,,
Anoka,MN,140 lb meth bust in Brooklyn Center 'largest in Minnesota ...,https://www.fox9.com/news/140-lb-meth-bust-in-brooklyn-center-largest-in-minnesota-history,13-May-16,"1. yes, the text mentions anoka, referring to the anoka county sheriff, james stuart, who commented on the success of the collaborative law enforcement effort in a methamphetamine bust.

2. no, the text does not relate to immigration raids or arrests. it discusses a drug bust in brooklyn center, mn, where methamphetamine was seized and two individuals were charged with possession with intent to distribute methamphetamine.

3. yes, the text mentions a date, specifically stating the article was published on may 13, 2016. this date is relatively close to 5/19/2016, being only six days earlier.

4. no, the text does not confirm that the raid was conducted by immigration and customs enforcement (ice). it mentions the u.s. drug enforcement administration (dea) and the anoka hennepin drug task force (ahdtf) as the investigating and raiding authorities.",,,,,,
Anoka,MN,Minor Offenses With Major Consequences,https://www.aila.org/File/Related/11081609.pdf,16-Aug-11,,,,,,,
Anoka,MN,A National Overview of Prostitution and Sex Trafficking ...,https://www.ojp.gov/pdffiles1/nij/grants/238796.pdf,2012,,,,,,,
Anoka,MN,Minnesota Drug Threat Assessment,https://www.justice.gov/archive/ndic/pubs0/678/678p.pdf,15-Aug-01,,,,,,,
Anoka,MN,Stolen Lives in Minnesota - cloudfront.net,https://d3n8a8pro7vhmx.cloudfront.net/cuapb/pages/17/attachments/original/1556948828/Minnesota_Stolen_Lives_Names_2018.pdf?1556948828,11-Mar-95,,,,,,,
Anoka,MN,"St. Paul pizza, ice cream parlor was front for marijuana ...",https://www.startribune.com/st-paul-pizza-ice-cream-parlor-was-front-for-marijuana-operation-run-by-local-man-his-mother-and-gra/297848481/,27-Mar-15,"1. yes, the text mentions mn as minnesota various times, indicating the region under discussion but does not mention anoka, mn specifically.

2. no, the text is not related to immigration raids or arrests. it is focused on a local drug trafficking operation involving a pizza and ice cream parlor in st. paul, minnesota.

3. yes, the text mentions the date as ""march 27, 2015,"" which is not around the date of 2/2/2017. it refers to the events and charges placed in relation to the year 2015 specifically.

4. no, the text does not confirm that the raid was conducted by immigration and customs enforcement. it refers to local police investigations and actions regarding a drug trafficking scheme, without any mention of immigration enforcement agencies.",,,,,,
Cumberland,ME,Chinese buffets in Maine linked to money laundering ...,https://www.bangordailynews.com/2011/11/16/news/bangor/federal-agents-raid-brewer-lewiston-eateries/,N/A,"1. yes, the text mentions cumberland county, me specifically. it states that the four individuals taken into custody as a result of the raids in portland and westbrook were held at cumberland county jail.

2. yes, the text is related to immigration raids/arrests. it details events where local police and federal agents conducted raids on chinese buffet restaurants in brewer, lewiston, waterville, and the portland area, shutting them down temporarily and taking several individuals described as immigrants into custody.

3. no, the text does not mention the date around 9/1/2017. the dates mentioned in the text are november 16, 2011, when the article was written, and january 27, 2012, when it was updated.

4. yes, the text confirms that the raid was conducted by immigration and customs enforcement, as well as other agencies. it mentions that witnesses saw agents from u.s. immigration and customs enforcement (ice), u.s. customs and border protection, and local police officers during the surprise entries at the restaurants.",,,,,,
Cumberland,ME,FY Case Number Date Received First Name Last ...,https://www.ice.gov/doclib/foia/icefoialogs/foialogseptember2007tonovember2008.pdf,N/A,"no, the text does not mention cumberland, me or me. there is no geographic location specified throughout the presented text.

no, the text is not related to immigration raids/arrests. the content provided does not discuss or reference immigration, raids, or arrests.

no, the text does not mention any specific dates, including 9/1/2017. there is no chronological information provided in the text.

no, the text does not confirm that any raid was conducted by immigration and customs enforcement. there is no mention of raids or any involvement of immigration and customs enforcement (ice) or any other agency.",,,,,,
Cumberland,ME,Drug charges denied | Local News,https://www.thesunchronicle.com/news/local_news/drug-charges-denied/article_d5c67afc-0c4f-52bc-817a-73bf9c1c2277.html,N/A,"1. no, the text does not mention cumberland, me (maine). it mentions jonathan d. coombs being from cumberland, but does not specify that it is maine, possibly implying cumberland in another state.

2. yes, the text is related to immigration raids/arrests. it specifically mentions that the u.s. immigration and customs enforcement (ice) was involved in the drug distribution probe which included raids and arrests.

3. no, the text notes dates but none are around september 1, 2017. the dates mentioned include the criminal events and related court appearances in march 2011, and the publication and other updates in april 2024.

4. yes, the text confirms that the raid was conducted by immigration and customs enforcement (ice). it clearly states their involvement in the ongoing undercover drug investigation resulting in the raids.",,,,,,
Cumberland,ME,SWAT Raid Nets Several Arrests... - Manchester Information,https://www.facebook.com/manchesterinformation/posts/swat-raid-nets-several-arrests-and-drugsthe-manchester-police-department-special/832022283627138/,N/A,,,,,,,
Cumberland,ME,Rhode Island Fed,https://www.justice.gov/sites/default/files/usao-ri/legacy/2011/04/04/RIFedWinter_07.pdf,N/A,"1. no, the text does not mention cumberland, me or me explicitly. this analysis is based on the content provided, and no geolocation such as cumberland or the state of maine (me) is mentioned in the text.

2. no, the text does not relate to immigration raids/arrests. the provided content does not contain any direct mention or references related to immigration, raids, arrests, or any related activities.

3. no, the text does not mention any date including around 9/1/2017. there is no indication of a date or time frame in the text that was provided.

4. no, the text does not confirm that the raid was conducted by immigration and customs enforcement. there is no mention of any raid or involvement of immigration and customs enforcement (ice) or any other law enforcement body in the text provided.",,,,,,
Cumberland,ME,Records of District Courts of the United States,https://www.archives.gov/research/guide-fed-records/groups/021.html,N/A,"1. no, the text does not mention cumberland, me or me (maine) explicitly anywhere within the provided content.

2. no, the text does not relate to immigration raids/arrests. the material primarily focuses on the archival records and procedural information about various u.s. district courts and associated historical judiciary data, without specific mention of immigration raids or arrests.

3. no, the text does not mention the date 9/1/2017 or any specific dates around it. the document seems to be a general description and index of court records, without references to specific contemporary dates like september 1, 2017.

4. no, the text does not confirm that any raid was conducted by immigration and customs enforcement (ice). there is no mention of ice or specifics of any operations such as raids conducted by ice or any other agency, as the content focuses on historical and administrative records of u.s. district courts.",,,,,,
Cumberland,ME,History _ Chinese American Friendship Association of Maine,https://cafammaine.org/history/,N/A,"1. yes, the text mentions ""cumberland, me"" when detailing an event involving mr. lam, where his application for naturalization was approved in the cumberland county superior court on march 3, 1876.
   
2. yes, the text is related to immigration raids/arrests somewhat, in the context of historical police raids on gambling activities within the chinese community, as described in an episode where portland police conducted a raid in an opulent gambling den.

3. no, the text does not mention the date of 9/1/2017 specifically or any date close to this. the document is a historical recount of various events and timelines without explicit mention of contemporary dates such as september 1, 2017.

4. no, the text does not confirm that any raid was conducted by immigration and customs enforcement (ice). the raids mentioned in the text are historical police actions, specifically referring to the early 1900s and not related to modern federal agencies like ice.",,,,,,
Cumberland,ME,immigration and ethnicity in New Jersey history,https://dspace.njstatelib.org/xmlui/bitstream/handle/10929/24561/h6731994.pdf?sequence=1&isAllowed=y,N/A,"1. no, the provided text does not mention cumberland, me or me explicitly. the content displayed primarily consists of encoded or binary data, likely extracted from pdf metadata and image objects, thus containing no readable context about geographical locations like cumberland, me.

2. no, the text is not related to immigration raids/arrests based on the content provided. the text is composed of encoded information, technical pdf encoding details, and random data that do not pertain to any narrative or specific topic, including immigration raids or arrests.

3. no, the text does not mention any specific dates, including the date of 9/1/2017. the contents displayed consist mainly of encoded or binary data, snippets of pdf internal structure, and do not include any readable text or context that indicates specific dates or events.

4. no, the text does not confirm that the raid was conducted by immigration and customs enforcement. the content comprises encoded data and other technical elements of pdf file encoding but lacks any mention or context related to immigration and customs enforcement or any law enforcement actions or operations.",,,,,,
Cumberland,ME,Cases Received Between 1/3/2011 and 12/30/2011,https://foia.state.gov/DOCUMENTS/9-FY2013/F-2011-07654/DOC_0C05262527/C05262527.pdf,N/A,"1. no, the text does not specifically mention cumberland, me or me as it is not possible to extract coherent location information from the provided text. 

2. no, the text does not relate to immigration raids/arrests based on the available content, which appears to be encoded or corrupted, thus not presenting readable information on this subject.

3. no, the text does not mention any dates, including 9/1/2017, as it does not contain readable or discernible data that would indicate a specific time frame.

4. no, there is no confirmation or mention of the raid being conducted by immigration and customs enforcement in the text, as the content provided does not contain any readable details about such operations.",,,,,,
Cumberland,ME,Chinese buffets in Maine linked to money laundering ...,https://www.bangordailynews.com/2011/11/16/news/bangor/federal-agents-raid-brewer-lewiston-eateries/,16-Nov-11,,,,,,,
Cumberland,ME,FY Case Number Date Received First Name Last ...,https://www.ice.gov/doclib/foia/icefoialogs/foialogseptember2007tonovember2008.pdf,1-Dec-08,,,,,,,
Cumberland,ME,Drug charges denied | Local News,https://www.thesunchronicle.com/news/local_news/drug-charges-denied/article_d5c67afc-0c4f-52bc-817a-73bf9c1c2277.html,26-Mar-11,,,,,,,
Cumberland,ME,Rhode Island Fed,https://www.justice.gov/sites/default/files/usao-ri/legacy/2011/04/04/RIFedWinter_07.pdf,4-Apr-11,,,,,,,
Cumberland,ME,Records of District Courts of the United States,https://www.archives.gov/research/guide-fed-records/groups/021.html,21-Jun-11,,,,,,,
Cumberland,ME,History _ Chinese American Friendship Association of Maine,https://cafammaine.org/history/,23-Jun-15,"1. yes, the text mentions ""cumberland, me"" when detailing an event involving mr. lam, where his application for naturalization was approved in the cumberland county superior court on march 3, 1876.
   
2. yes, the text is related to immigration raids/arrests somewhat, in the context of historical police raids on gambling activities within the chinese community, as described in an episode where portland police conducted a raid in an opulent gambling den.

3. no, the text does not mention the date of 9/1/2017 specifically or any date close to this. the document is a historical recount of various events and timelines without explicit mention of contemporary dates such as september 1, 2017.

4. no, the text does not confirm that any raid was conducted by immigration and customs enforcement (ice). the raids mentioned in the text are historical police actions, specifically referring to the early 1900s and not related to modern federal agencies like ice.",,,,,,
Cumberland,ME,immigration and ethnicity in New Jersey history,https://dspace.njstatelib.org/xmlui/bitstream/handle/10929/24561/h6731994.pdf?sequence=1&isAllowed=y,28-Jul-14,"1. no, the provided text does not mention cumberland, me or me explicitly. the content displayed primarily consists of encoded or binary data, likely extracted from pdf metadata and image objects, thus containing no readable context about geographical locations like cumberland, me.

2. no, the text is not related to immigration raids/arrests based on the content provided. the text is composed of encoded information, technical pdf encoding details, and random data that do not pertain to any narrative or specific topic, including immigration raids or arrests.

3. no, the text does not mention any specific dates, including the date of 9/1/2017. the contents displayed consist mainly of encoded or binary data, snippets of pdf internal structure, and do not include any readable text or context that indicates specific dates or events.

4. no, the text does not confirm that the raid was conducted by immigration and customs enforcement. the content comprises encoded data and other technical elements of pdf file encoding but lacks any mention or context related to immigration and customs enforcement or any law enforcement actions or operations.",,,,,,
Cumberland,ME,Cases Received Between 1/3/2011 and 12/30/2011,https://foia.state.gov/DOCUMENTS/9-FY2013/F-2011-07654/DOC_0C05262527/C05262527.pdf,30-Dec-11,,,,,,,
Cumberland,ME,Indicators of Labor Trafficking Among North Carolina ...,https://www.ojp.gov/pdffiles1/nij/grants/244204.pdf,2013,,,,,,,
Cumberland,ME,For Cops Who Want to Help ICE Crack Down on Illegal ...,https://www.propublica.org/article/pennsylvania-immigration-ice-crackdown-cops-free-for-all,12-Apr-18,"1. no, the text does not mention cumberland, me or me (maine). the text refers to cumberland county, but this is specifically in the context of pennsylvania, not maine.

2. yes, the text is related to immigration raids/arrests. it discusses the role of local and state police in pennsylvania in detaining undocumented immigrants during traffic stops and other interactions, and how these local actions were coordinating with or led to involvement from immigration and customs enforcement (ice).

3. yes, the text mentions the date. it says the article was published on april 12, 2018. while this is not exactly on the date of 3/28/2018, it is relatively close, being published only about two weeks later.

4. yes, the text confirms that the raids were conducted by immigration and customs enforcement (ice). it discusses various instances where local police in pennsylvania detained undocumented immigrants and then handed them over to ice for further action and possible deportation. the involvement of ice in these scenarios is explicitly mentioned multiple times throughout the text.",,,,,,
Cumberland,ME,ICE's Philadelphia office has ramped up arrests of ...,https://www.inquirer.com/news/inq/ices-philadelphia-office-has-ramped-up-arrests-undocumented-immigrants-20180412.html,12-Apr-18,"1. no, the text does not mention cumberland, me or me (maine). there is no reference to any geographical location other than philadelphia.

2. yes, the text is related to immigration raids/arrests. it specifically mentions that ice's philadelphia office has ramped up arrests of undocumented immigrants, indicating that the text discusses immigration enforcement activities.

3. no, the text does not mention the date 3/28/2018 or any specific date around that time. the only year mentioned is 2024, indicating that the content was published or relevant to that year.

4. yes, the text confirms that the raid was conducted by immigration and customs enforcement (ice). it explicitly states that ""ice__ philadelphia office has ramped up arrests of undocumented immigrants,"" indicating that ice is the agency involved in these actions.",,,,,,
Cumberland,ME,"In Pennsylvania, It's Open Season on Undocumented ...",https://www.propublica.org/article/pennsylvania-ice-undocumented-immigrants-immigration-enforcement,12-Apr-18,"1. no, the text does not mention cumberland, me or me (maine). it discusses various locations in pennsylvania and briefly mentions other states and areas related to immigration enforcement, but maine is not mentioned.

2. yes, the text is related to immigration raids/arrests. it extensively details actions taken by ice (immigration and customs enforcement) in pennsylvania, west virginia, and delaware, including various stories and statistics about apprehensions and the impacts of ice's enforcement activities on communities and individuals.

3. yes, the text includes a date, although it mentions april 12, 2018, rather than being around the date of 3/28/2018. the publication date of april 12, 2018, is specified in the text, indicating the timing of the report but not exactly around march 28, 2018.

4. yes, the text confirms that the raid was conducted by immigration and customs enforcement (ice). it discusses various operations and enforcement activities handled by ice, detailing their approach and impact, particularly focusing on their activities in the philadelphia office region including policy changes and enforcement dynamics under the new administrative direction.",,,,,,
Cobb,GA,"Raids Net Meth, Cocaine Worth $266K",https://patch.com/georgia/canton-ga/raids-net-meth-cocaine-worth-266k,10-Jan-12,,,,,,,
Cobb,GA,"Colotl fate rests on DA, Sheriff deal",https://www.wsbtv.com/news/local/colotl-fate-rests-da-sheriff-deal/241649044/,7-Oct-11,,,,,,,
Cobb,GA,11 indicted for laundering $40 million in Atlanta-area drug ...,https://www.ice.gov/news/releases/11-indicted-laundering-40-million-atlanta-area-drug-proceeds,26-Jun-17,"1. no, the text does not mention cobb, ga. it refers to various locations in the atlanta area and specific other locations like lawrenceville and chamblee in georgia, but does not mention cobb.

2. no, the text is not related to immigration raids/arrests. the content primarily discusses a case of money laundering where individuals were indicted for laundering drug proceeds. while it involves u.s. immigration and customs enforcement (ice), the focus is on financial crimes rather than on immigration enforcement actions like raids or arrests for immigration violations.

3. yes, the text mentions a date, which is june 22, 2017. this date is close but not exactly the date you inquired about (10/4/2017); however, it's within the same year.

4. yes, the text confirms that the raid was conducted by immigration and customs enforcement (ice). it specifically states that the investigation was led by u.s. immigration and customs enforcement's homeland security investigations (hsi) and the irs, indicating ice's involvement in the execution of the operation.",,,,,,
Cobb,GA,Felony gambling raid in Marietta,https://www.youtube.com/watch?v=HLXhL9YLowQ,N/A,"1. no, the text does not explicitly mention cobb, ga or ga. it only mentions marietta, which is known to be in cobb county, georgia, but it does not specifically state ""cobb, ga"" or ""ga.""

2. no, the text is not related to immigration raids/arrests. it specifically mentions a ""felony gambling raid,"" which indicates a connection to gambling-related activities rather than immigration issues.

3. no, the text does not mention a specific date related to the events described, nor does it mention if the events occurred around the date of 10/4/2017.

4. no, the text does not confirm that the raid was conducted by immigration and customs enforcement. it doesn't specify which agency carried out the raid, only describing it as a ""felony gambling raid.""",,,,,,
Cobb,GA,"Operation Spider Web Snags Cocaine, Meth, and Weapons",https://archives.fbi.gov/archives/atlanta/press-releases/2011/at012011-1.htm,20-Jan-11,,,,,,,
Cobb,GA,Eight Members Of Mexican Drug Trafficking Organization ...,https://www.justice.gov/usao-ndga/pr/eight-members-mexican-drug-trafficking-organization-operating-atlanta-sentenced-federal,18-Dec-14,"1. yes, the text mentions cobb, specifically in relation to the ""mcs (marietta cobb smyrna) narcotics unit"" which provided assistance in the drug trafficking investigation mentioned.

2. no, the text does not relate to immigration raids or arrests specifically. it discusses a drug bust and sentences related to a methamphetamine trafficking organization. while immigration status is mentioned in passing about alonso alfonso rivera, the main focus is on drug trafficking, not immigration enforcement.

3. yes, the text mentions a specific date, but it is not around 10/4/2017. the press release is dated december 18, 2014, and it discusses events and actions that took place around that time, including search warrants executed in january 2013.

4. no, the text does not confirm that the raid was conducted by immigration and customs enforcement (ice). it mentions the involvement of several law enforcement agencies including dea, atf, irs, fbi, and various local and state police departments, but does not list ice as one of the agencies involved in the operation.",,,,,,
Cobb,GA,"News from DEA, Domestic Field Divisions, Atlanta ...",https://www.dea.gov/sites/default/files/pubs/states/newsrel/atlanta091604.html,16-Sep-04,,,,,,,
